Сила і Честь,211,1212,2019-07-05,56,ПП ВІСМА-РАДІО-ТБ,"м. Київ, вул. Володимирська, буд. 61/11, кв. 50",24388823,"+;1212;оплата ефірного часу на радіо, зг-но рах. №ВС29 від 01.07.2019, в т.ч. ПДВ-88,56 грн.","531,36",юридична особа,оплата ефірного часу на радіо
Сила і Честь,211,1212,2019-07-05,71,ТОВ ТРК Радіо великих доріг,"м. Київ, вул. Володимирська, буд. 61/11, кв. 50",32355150,"+;1212;оплата ефірного часу на радіо, зг-но рах. №РВ38 від 01.07.2019, без ПДВ.","604,8",юридична особа,оплата ефірного часу на радіо
Сила і Честь,211,1212,2019-07-05,74,ТОВ ТРК БЕЛКОМ,"м. Київ, вул. Володимирська, буд. 61/11, кв. 50",32276619,"+;1212;оплата ефірного часу на радіо, зг-но рах. №БЛ36 від 01.07.2019, в т.ч. ПДВ-120,96 грн.","725,76",юридична особа,оплата ефірного часу на радіо
Сила і Честь,211,1212,2019-07-05,73,ТОВ Контакт-Інформ,"м. Київ, вул. Володимирська, буд. 61/11, кв. 50",36045376,"+;1212;оплата ефірного часу на радіо, зг-но рах. №КІ30 від 01.07.2019, в т.ч. ПДВ-174,96 грн.","1049,76",юридична особа,оплата ефірного часу на радіо
Сила і Честь,211,1212,2019-07-05,62,"ТОВ ""Телерадіокомпанія ""Новий день""","м. Кропивницький, вул. Чорновола, буд. 36Б",37298045,"+;1212;оплата ефірного часу на радіо, зг-но рах. №СФ-0000045 від 01.07.2019, без ПДВ.",1050,юридична особа,оплата ефірного часу на радіо
Сила і Честь,211,1212,2019-07-05,65,ПП РК Черкаси-Вибір,"м. Черкаси, бул. Шевченка, буд. 195/1",30147008,"+;1212;оплата ефірного часу на радіо, зг-но рах. №СФ-ВР00006 від 01.07.2019, без ПДВ.",1050,юридична особа,оплата ефірного часу на радіо
Сила і Честь,211,1212,2019-07-05,67,"ДП ""Телерадіокомпанія ""Регіон-плюс""","м. Краматорськ, вул. Леніна, буд. 58",24811482,"+;1212;оплата ефірного часу на радіо, зг-но рах. №СФ-0000030 від 02.07.2019, без ПДВ.",1050,юридична особа,оплата ефірного часу на радіо
Сила і Честь,211,1212,2019-07-05,68,"ТОВ ""Бойчук-студія""","м. Івано-Франківськ, вул. Галицька, буд. 67, оф. 503",22188659,"+;1212;оплата ефірного часу на радіо, зг-но рах. №50 від 02.07.2019, без ПДВ.",1050,юридична особа,оплата ефірного часу на радіо
Сила і Честь,211,1212,2019-07-05,70,ТОВ ТРК Імідж TV,"м. Вознесенськ, вул. Тимірязєва, буд. 175",20907141,"+;1212;оплата ефірного часу на радіо, зг-но рах. №64 від 01.07.2019, без ПДВ.",1050,юридична особа,оплата ефірного часу на радіо
Сила і Честь,211,1212,2019-07-05,79,ТОВ Євромюзік,"м. Київ, бульв. Тараса Шевченка, буд. 54/1",37027503,"+;1212;оплата ефірного часу на радіо, зг-но рах. №2/9 від 02.07.2019, без ПДВ.",1050,юридична особа,оплата ефірного часу на радіо
Сила і Честь,211,1212,2019-07-05,45,ТОВ ТРК Музично-інформаційне радіо,"м. Миколаїв, вул. Інженерна, буд. 18/1",33969097,"+;1212;оплата ефірного часу на радіо, зг-но рах. №СФ-0000094 від 01.07.2019, в т.ч. ПДВ-210,00 грн.",1260,юридична особа,оплата ефірного часу на радіо
Сила і Честь,211,1212,2019-07-05,47,ТОВ ТРК МЕДІА ФМ,"м. Дніпро, вул. Робоча, буд. 23В",33116009,"+;1212;оплата ефірного часу на радіо, зг-но рах. №01-07-19/001 від 01.07.2019, в т.ч. ПДВ-210,00 грн.",1260,юридична особа,оплата ефірного часу на радіо
Сила і Честь,211,1212,2019-07-05,50,ТОВ ТРК ВАШЕ РАДІО,"м. Херсон, парк Ленінського комсомолу, кафе ""Молодіжне""",24960420,"+;1212;оплата ефірного часу на радіо, зг-но рах. №80 від 01.07.2019, в т.ч. ПДВ-210,00 грн.",1260,юридична особа,оплата ефірного часу на радіо
Сила і Честь,211,1212,2019-07-05,59,ТОВ ТРК Унісон плюс,"м. Чернігів, просп. Перемоги, буд. 114",32016577,"+;1212;оплата ефірного часу на радіо, зг-но рах. №СФ-0000031 від 01.07.2019, в т.ч. ПДВ-210,00 грн.",1260,юридична особа,оплата ефірного часу на радіо
Сила і Честь,211,1212,2019-07-05,60,ТОВ ТРК Нова хвиля,"м. Одеса, вул. Середньофонтанська, буд. 19А, оф. 320",35358531,"+;1212;оплата ефірного часу на радіо, зг-но рах. №33 від 01.07.2019, в т.ч. ПДВ-210,00 грн.",1260,юридична особа,оплата ефірного часу на радіо
Сила і Честь,211,1212,2019-07-05,61,ТОВ ТРК Пілот,"м. Вінниця, вул. Хмельницьке шосе, буд. 2, кімн. 717",24897584,"+;1212;оплата ефірного часу на радіо, зг-но рах. №СФ-0000037 від 01.07.2019, в т.ч. ПДВ-210,00 грн.",1260,юридична особа,оплата ефірного часу на радіо
Сила і Честь,211,1212,2019-07-05,63,"ТОВ ""Радіо тон""","м. Тернопіль, вул. Камінна, буд. 5, оф. 13",21155577,"+;1212;оплата ефірного часу на радіо, зг-но рах. №СФ-00000364 від 01.07.2019, в т.ч. ПДВ-210,00 грн.",1260,юридична особа,оплата ефірного часу на радіо
Сила і Честь,211,1212,2019-07-05,66,ПП ТРК Місто ФМ,"м. Запоріжжя, просп. Соборний, буд. 167, оф. 1",34563984,"+;1212;оплата ефірного часу на радіо, зг-но рах. №СФ-0000033 від 01.07.2019, в т.ч. ПДВ-210,00 грн.",1260,юридична особа,оплата ефірного часу на радіо
Сила і Честь,211,1212,2019-07-05,77,ТОВ ТРК Контакт,"м. Київ, бульв. Тараса Шевченка, буд. 54/1",24512176,"+;1212;оплата ефірного часу на радіо, зг-но рах. №2/9 від 02.07.2019, в т.ч. ПДВ-315,00 грн.",1575,юридична особа,оплата ефірного часу на радіо
Сила і Честь,211,1211,2019-07-05,148,КП Муніципальна телевізійна мережа,"м. Запоріжжя, вул. Приходська, буд. 60",24905384,"+;1211;оплата ефірного часу на телебаченні, з-но рах. №СФ-0000111 від 01.07.2019, в т.ч. ПДВ-333,33 грн.",2000,юридична особа,оплата ефірного часу на телебаченні
Сила і Честь,211,1212,2019-07-05,53,ПП ТРО Софія,"м. Херсон, вул. 49 Гвардійської дивізії, буд. 16, корп. 1",32479351,"+;1212;оплата ефірного часу на радіо, зг-но рах. №86 від 01.07.2019, в т.ч. ПДВ-393,12 грн.","2358,72",юридична особа,оплата ефірного часу на радіо
Сила і Честь,211,1212,2019-07-05,64,ТОВ Радіо FM,"м. Київ, вул. Вікентія Хвойки, буд. 15/15",23980419,"+;1212;оплата ефірного часу на радіо, зг-но рах. №СФ-0000025 від 01.07.2019, в т.ч. ПДВ-420,00 грн.",2520,юридична особа,оплата ефірного часу на радіо
Сила і Честь,211,1212,2019-07-05,54,ПП ТРК Подільські комунікації,"м. Ладижин, вул. Процишина, буд. 45, кв. 91",34261211,"+;1212;оплата ефірного часу на радіо, зг-но рах. №СФ-0000030 від 01.07.2019, без ПДВ.",3240,юридична особа,оплата ефірного часу на радіо
Сила і Честь,211,1212,2019-07-05,55,ТОВ РК Армянське радіо-Україна,"м. Київ, вул. Грушевського, буд. 28/2, прим. 43",31513637,"+;1212;оплата ефірного часу на радіо, зг-но рах. №26 від 27.06.2019, в т.ч. ПДВ-606,96 грн.","3641,76",юридична особа,оплата ефірного часу на радіо
Сила і Честь,211,1212,2019-07-05,75,"ДП ""Телерадіокомпанія ""Люкс""","м. Київ, вул. Володимирська, буд. 61/11, кв. 50",36885235,"+;1212;оплата ефірного часу на радіо, зг-но рах. №ДП30 від 01.07.2019, в т.ч. ПДВ-606,96 грн.","3641,76",юридична особа,оплата ефірного часу на радіо
Сила і Честь,211,1212,2019-07-05,49,ТОВ ТРК КЛАСИК РАДІО,"м. Київ, вул. Павлівська, буд. 29, кімн. 33",35946731,"+;1212;оплата ефірного часу на радіо, зг-но рах. №СФ-0000042 від 01.07.2019, в т.ч. ПДВ-630,00 грн.",3780,юридична особа,оплата ефірного часу на радіо
Сила і Честь,211,1400,2019-07-05,84,"ТОВ ""Видавничий дім ""Високий замок""","м. Львів, вул. Героїв УПА, буд. 65",13807781,"+;1400;Інші витрати на передвиборну агітацію (інформаційні послуги на сайті), згідно рах. № ВЗ-0000659 від 02.07.2019, в т.ч. ПДВ-630,00грн.",3780,юридична особа,"Інші витрати на передвиборну агітацію (розповсюдження виборчих листівок, плакатів та інших друкованих агітаційних матеріалів чи друкованих видань; проведення мітингів, походів, демонстрацій, пікетів, концертів, вистав, спортивних змагань, демонстрації фільмів та телепередач чи інших публічних заходів за підтримки політичної партії – суб’єкта виборчого процесу чи кандидата на пост Президента України тощо)"
Сила і Честь,211,1212,2019-07-05,46,"ДП ""Телерадіокомпанія ""Класик""","м. Запоріжжя, вул. Олександра Матросова, буд. 8А, кімн. 104",36065717,"+;1212;оплата ефірного часу на радіо, зг-но рах. №СФ-34 від 27.06.2019, без ПДВ.","3784,32",юридична особа,оплата ефірного часу на радіо
Сила і Честь,211,1212,2019-07-05,78,ТОВ ТРК Шансон,"м. Київ, бульв. Тараса Шевченка, буд. 54/1",24085596,"+;1212;оплата ефірного часу на радіо, зг-но рах. №2/9 від 02.07.2019, в т.ч. ПДВ-700,00 грн.",4200,юридична особа,оплата ефірного часу на радіо
Сила і Честь,211,1211,2019-07-05,102,"ПАТ ""НСТУ""","м. Київ, вул. Мельникова, буд. 42",23152907,"+;1211;оплата ефірного часу на телебаченні, з-но рах. №НТК000000021 від 03.07.2019, в т.ч. ПДВ-707,20 грн.","4246,2",юридична особа,оплата ефірного часу на телебаченні
Сила і Честь,211,1212,2019-07-05,58,ТОВ НТРК ІРТА,"м. Сєвєродонецьк, просп. Гвардійський, буд. 13/410",31530558,"+;1212;оплата ефірного часу на радіо, зг-но рах. №4-27/06/19 від 27.06.2019, в т.ч. ПДВ-972,00 грн.",5832,юридична особа,оплата ефірного часу на радіо
Сила і Честь,211,1211,2019-07-05,138,"Івано-Франківське обласне телебачення ""Галичина""","м. Івано-Франківськ, вул. Грушевського, буд. 21, оф. 701",13641427,"+;1211;оплата ефірного часу на телебаченні, з-но рах. №231 від 01.07.2019, в т.ч. ПДВ-1066,67 грн.",6400,юридична особа,оплата ефірного часу на телебаченні
Сила і Честь,211,1212,2019-07-05,52,ТОВ ТРК Ностальгія,"м. Київ, вул. Щорса, буд. 32А, кв. 94",30632797,"+;1212;оплата ефірного часу на радіо, зг-но рах. №РН12 від 01.07.2019, в т.ч. ПДВ-1157,76 грн.","6946,56",юридична особа,оплата ефірного часу на радіо
Сила і Честь,211,1211,2019-07-05,117,"ТОВ ""Телерадіокомпанія ""РАІ""","м. Івано-Франківськ, вул. Василіянок, буд. 15",36983355,"+;1211;оплата ефірного часу на телебаченні, з-но рах. №149 від 27.06.2019, без ПДВ.",7200,юридична особа,оплата ефірного часу на телебаченні
Сила і Честь,211,1211,2019-07-05,103,"ПАТ ""НСТУ""","м. Київ, вул. Мельникова, буд. 42",23152907,"+;1211;оплата ефірного часу на телебаченні, з-но рах. №НТК000000021 від 03.07.2019, в т.ч. ПДВ-1501,50 грн.",9009,юридична особа,оплата ефірного часу на телебаченні
Сила і Честь,211,1211,2019-07-05,144,ТОВ ТРК АЛЕКС,"м. Запоріжжя, просп. Моторобудівників, буд. 48",23286602,"+;1211;оплата ефірного часу на телебаченні, з-но рах. №СФ-0000204 від 01.07.2019, в т.ч. ПДВ-1530,00 грн.",9180,юридична особа,оплата ефірного часу на телебаченні
Сила і Честь,211,1211,2019-07-05,109,"ПАТ ""НСТУ""","м. Київ, вул. Мельникова, буд. 42",23152907,"+;1211;оплата ефірного часу на телебаченні, з-но рах. №НТК000000031 від 05.07.2019, в т.ч. ПДВ-1685,00 грн.",10110,юридична особа,оплата ефірного часу на телебаченні
Сила і Честь,211,1211,2019-07-05,101,ТОВ ТРК ТВ-7,"м. Маріуполь, Приморський бульв., буд. 25",25106350,"+;1211;оплата ефірного часу на телебаченні, з-но рах. №169 від 03.07.2019, в т.ч. ПДВ-1705,80 грн.","10234,8",юридична особа,оплата ефірного часу на телебаченні
Сила і Честь,211,1211,2019-07-05,85,"ПАТ ""ТРК ""ПРАВО/ТВК""","м. Харків, вул. Ярослава Мудрого, буд. 3",22722874,"+;1211;оплата ефірного часу на телебаченні, з-но рах. №67 від 05.07.2019, без ПДВ.",12000,юридична особа,оплата ефірного часу на телебаченні
Сила і Честь,211,1212,2019-07-05,72,ПАТ Радіокомпанія Люкс,"м. Київ, вул. Володимирська, буд. 61/11, кв. 50",23158131,"+;1212;оплата ефірного часу на радіо, зг-но рах. №КЛ42 від 01.07.2019, в т.ч. ПДВ-2047,68 грн.","12286,08",юридична особа,оплата ефірного часу на радіо
Сила і Честь,211,1211,2019-07-05,133,ТОВ Івано-Франк.ТРК КАНАЛ-402,"м. Івано-Франківськ, вул. Чорновола, буд. 99",13642036,"+;1211;оплата ефірного часу на телебаченні, з-но рах. №057 від 01.07.2019, в т.ч. ПДВ-2100,00 грн.",12600,юридична особа,оплата ефірного часу на телебаченні
Сила і Честь,211,1211,2019-07-05,142,ТОВ ТРК Херсон плюс,"м. Херсон, вул. Торгова, буд. 37",36944934,"+;1211;оплата ефірного часу на телебаченні, з-но рах. №000203-к від 02.07.2019, без ПДВ.",12600,юридична особа,оплата ефірного часу на телебаченні
Сила і Честь,211,1212,2019-07-05,83,ТОВ ТРК Радіо-ера,"м. Київ, вул. Кирилівська, буд. 86",30019068,"+;1212;оплата ефірного часу на радіо, зг-но рах. №182 від 04.07.2019, без ПДВ.","13078,8",юридична особа,оплата ефірного часу на радіо
Сила і Честь,211,1211,2019-07-05,110,ТОВ ТРК МОЯ ОДЕСА,"м. Одеса, вул. Канатна, буд. 10",31068509,"+;1211;оплата ефірного часу на телебаченні, з-но рах. №77 від 05.07.2019, в т.ч. ПДВ-2400,00 грн.",14400,юридична особа,оплата ефірного часу на телебаченні
Сила і Честь,211,1211,2019-07-05,105,ТОВ ТРК ІРТ-Полтава,"м. Полтава, вул. Конституції, буд. 4",35026331,"+;1211;оплата ефірного часу на телебаченні, з-но рах. №ІР-2866/2 від 02.07.2019, в т.ч. ПДВ-2520,00 грн.",15120,юридична особа,оплата ефірного часу на телебаченні
Сила і Честь,211,1212,2019-07-05,48,"ПП ""Фірма ""Лямін""","м. Київ, вул. Палівська, буд. 29, кімн. 30",19488636,"+;1212;оплата ефірного часу на радіо, зг-но рах. №СФ-0000316 від 01.07.2019, в т.ч. ПДВ-2730,00 грн.",16380,юридична особа,оплата ефірного часу на радіо
Сила і Честь,211,1211,2019-07-05,116,"ТОВ ""Телерадіокомпанія ""РАІ""","м. Івано-Франківськ, вул. Василіянок, буд. 15",36983355,"+;1211;оплата ефірного часу на телебаченні, з-но рах. №148 від 01.07.2019, без ПДВ.",17220,юридична особа,оплата ефірного часу на телебаченні
Сила і Честь,211,1211,2019-07-05,132,ТОВ Івано-Франк.ТРК КАНАЛ-402,"м. Івано-Франківськ, вул. Чорновола, буд. 99",13642036,"+;1211;оплата ефірного часу на телебаченні, з-но рах. №056 від 01.07.2019, в т.ч. ПДВ-2880,00 грн.",17280,юридична особа,оплата ефірного часу на телебаченні
Сила і Честь,211,1211,2019-07-05,139,"Івано-Франківське обласне телебачення ""Галичина""","м. Івано-Франківськ, вул. Грушевського, буд. 21, оф. 701",13641427,"+;1211;оплата ефірного часу на телебаченні, з-но рах. №230 від 01.07.2019, в т.ч. ПДВ-2940,00 грн.",17640,юридична особа,оплата ефірного часу на телебаченні
Сила і Честь,211,1211,2019-07-05,146,ТОВ МЕДІАГРУП АЛЕКС.ЮА,"м. Запоріжжя, просп. Моторобудівників, буд. 48",24451003,"+;1211;оплата ефірного часу на телебаченні, з-но рах. №СФ-0000131 від 01.07.2019, в т.ч. ПДВ-3060,00 грн.",18360,юридична особа,оплата ефірного часу на телебаченні
Сила і Честь,211,1211,2019-07-05,89,КП ТРК РУДАНА КМР,"м. Кривий Ріг, просп. Гагаріна, буд. 68",19438354,"+;1211;оплата ефірного часу на телебаченні, з-но рах. №183 від 03.07.2019, в т.ч. ПДВ-3106,25 грн.","18637,5",юридична особа,оплата ефірного часу на телебаченні
Сила і Честь,211,1211,2019-07-05,126,ТОВ ТРК ВІККА,"м. Черкаси, вул. Юрія Іллєнка, буд. 27",21385292,"+;1211;оплата ефірного часу на телебаченні, з-но рах. №СФ-000721 від 05.07.2019, в т.ч. ПДВ-3150,00 грн.",18900,юридична особа,оплата ефірного часу на телебаченні
Сила і Честь,211,1211,2019-07-05,149,КП Муніципальна телевізійна мережа,"м. Запоріжжя, вул. Приходська, буд. 60",24905384,"+;1211;оплата ефірного часу на телебаченні, з-но рах. №СФ-0000109 від 01.07.2019, в т.ч. ПДВ-3150,00 грн.",18900,юридична особа,оплата ефірного часу на телебаченні
Сила і Честь,211,1211,2019-07-05,93,ТОВ ТРК TTV,"м. Кропивницький, вул. Медвєдева, буд. 1А",13745760,"+;1211;оплата ефірного часу на телебаченні, з-но рах. №63 від 04.07.2019, в т.ч. ПДВ-3150,00 грн.",18900,юридична особа,оплата ефірного часу на телебаченні
Сила і Честь,211,1211,2019-07-05,130,ПМП ТРК ДАНІО,"м. Ужгород, вул. Крилова, буд. 10",20430464,"+;1211;оплата ефірного часу на телебаченні, з-но рах. №40 від 04.07.2019. в т.ч. ПДВ-3402,00 грн.",20412,юридична особа,оплата ефірного часу на телебаченні
Сила і Честь,211,1211,2019-07-05,131,ТОВ ТРК СОЮЗ-ТВ,"м. Житомир, просп. Миру, буд. 11, кв. 158",25304801,"+;1211;оплата ефірного часу на телебаченні, з-но рах. №5/1 від 05.07.2019, в т.ч. ПДВ-3775,00 грн.",22650,юридична особа,оплата ефірного часу на телебаченні
Сила і Честь,211,1211,2019-07-05,128,ТОВ ТРК Академія TV,"м. Суми, вул. Харківська, буд. 4",32185841,"+;1211;оплата ефірного часу на телебаченні, з-но рах. №227 выд 05.07.2019, в т.ч. ПДВ-3780,00 грн.",22680,юридична особа,оплата ефірного часу на телебаченні
Сила і Честь,211,1211,2019-07-05,124,ТОВ ЗНТРК ТВ-5,"м. Запоріжжя, вул. О. Пивоварова, буд. 4А",13630346,"+;1211;оплата ефірного часу на телебаченні, з-но рах. №0243 від 01.07.2019, в т.ч. ПДВ-3800,00 грн.",22800,юридична особа,оплата ефірного часу на телебаченні
Сила і Честь,211,1211,2019-07-05,118,"ТОВ ""Телерадіокомпанія ""РАІ""","м. Івано-Франківськ, вул. Василіянок, буд. 15",36983355,"+;1211;оплата ефірного часу на телебаченні, з-но рах. №180 від 05.07.2019, без ПДВ.",24000,юридична особа,оплата ефірного часу на телебаченні
Сила і Честь,211,1212,2019-07-05,51,ПАТ ТРК ЛЮКС,"м. Львів, пл. Галицька, буд. 15",20765851,"+;1212;оплата ефірного часу на радіо, зг-но рах. №ЛВ502 від 01.07.2019, в т.ч. ПДВ-4136,40 грн.","24818,4",юридична особа,оплата ефірного часу на радіо
Сила і Честь,211,1211,2019-07-05,136,"Івано-Франківське обласне телебачення ""Галичина""","м. Івано-Франківськ, вул. Грушевського, буд. 21, оф. 701",13641427,"+;1211;оплата ефірного часу на телебаченні, з-но рах. №232 від 01.07.2019, в т.ч. ПДВ-4166,67 грн.",25000,юридична особа,оплата ефірного часу на телебаченні
