Сила і Честь,211,1211,2019-07-05,90,ТОВ Коледж преси та телебачення,"м. Миколаїв, вул. Даял, буд. 11А",20914191,"+;1211;оплата ефірного часу на телебаченні, з-но рах. №1-СІЧ від 03.07.2019, без ПДВ.",25200,юридична особа,оплата ефірного часу на телебаченні
Сила і Честь,211,1211,2019-07-05,98,ТОВ ТРК НІС-ТВ,"м. Миколаїв, вул. Чкалова, буд. 30А",20874043,"+;1211;оплата ефірного часу на телебаченні, з-но рах. №128 від 03.07.2019, в т.ч. ПДВ-4536,00 грн.",27216,юридична особа,оплата ефірного часу на телебаченні
Сила і Честь,211,1211,2019-07-05,119,ПП ТРК ВТВ плюс,"м. Херсон, вул. Богородицька, буд. 10/5, кв. 4",24959285,"+;1211;оплата ефірного часу на телебаченні, з-но рах. №106 від 03.07.2019, в т.ч. ПДВ-4620,00 грн.",27720,юридична особа,оплата ефірного часу на телебаченні
Сила і Честь,211,1211,2019-07-05,104,ТОВ ТРК ІРТ-Полтава,"м. Полтава, вул. Конституції, буд. 4",35026331,"+;1211;оплата ефірного часу на телебаченні, з-но рах. №ІР-2866/1 від 02.07.2019, в т.ч. ПДВ-4900,00 грн.",29400,юридична особа,оплата ефірного часу на телебаченні
Сила і Честь,211,1211,2019-07-05,111,ТОВ ТРК МОЯ ОДЕСА,"м. Одеса, вул. Канатна, буд. 10",31068509,"+;1211;оплата ефірного часу на телебаченні, з-но рах. №76 від 05.07.2019, в т.ч. ПДВ-5000,00 грн.",30000,юридична особа,оплата ефірного часу на телебаченні
Сила і Честь,211,1211,2019-07-05,141,ТОВ ТРК Херсон плюс,"м. Херсон, вул. Торгова, буд. 37",36944934,"+;1211;оплата ефірного часу на телебаченні, з-но рах. №000206-к від 04.07.2019, без ПДВ.",30000,юридична особа,оплата ефірного часу на телебаченні
Сила і Честь,211,1211,2019-07-05,125,ТОВ ЗНТРК ТВ-5,"м. Запоріжжя, вул. О. Пивоварова, буд. 4А",13630346,"+;1211;оплата ефірного часу на телебаченні, з-но рах. №0248 від 03.07.2019, в т.ч. ПДВ-5003,33 грн.",30020,юридична особа,оплата ефірного часу на телебаченні
Сила і Честь,211,1211,2019-07-05,96,ПП ТРК СФЕРА-ТВ,"м. Рівне, вул. Міцкевича, буд. 11, оф. 30",33910609,"+;1211;оплата ефірного часу на телебаченні, з-но рах. №11/п/1 від 05.07.2019, без ПДВ.",30240,юридична особа,оплата ефірного часу на телебаченні
Сила і Честь,211,1211,2019-07-05,100,ТОВ ТРК ТВ-7,"м. Маріуполь, Приморський бульв., буд. 25",25106350,"+;1211;оплата ефірного часу на телебаченні, з-но рах. №175 від 05.07.2019, в т.ч. ПДВ-5160,00 грн.",30960,юридична особа,оплата ефірного часу на телебаченні
Сила і Честь,211,1211,2019-07-05,143,ТОВ ТРК АЛЕКС,"м. Запоріжжя, просп. Моторобудівників, буд. 48",23286602,"+;1211;оплата ефірного часу на телебаченні, з-но рах. №СФ-0000203 від 01.07.2019, в т.ч. ПДВ-5265,00 грн.",31590,юридична особа,оплата ефірного часу на телебаченні
Сила і Честь,211,1211,2019-07-05,147,ТОВ ТРО ЛІГА,"м. Чернігів, просп. Миру, буд. 32",24834454,"+;1211;оплата ефірного часу на телебаченні, з-но рах. №СФ-0000172 від 01.07.2019, в т.ч. ПДВ-5380,00 грн.",32280,юридична особа,оплата ефірного часу на телебаченні
Сила і Честь,211,1211,2019-07-05,151,КП ТРА Новий Чернігів ЧМР,"м. Чернігів, просп. Миру, буд. 38А",21397527,"+;1211;оплата ефірного часу на телебаченні, з-но рах. №112 від 02.07.2019, в т.ч. ПДВ-5600,00 грн.",33600,юридична особа,оплата ефірного часу на телебаченні
Сила і Честь,211,1211,2019-07-05,108,ТОВ ТРКК СИГМА,"м. Маріуполь, вул. Харлампіївська, буд. 17/25",13482897,"+;1211;оплата ефірного часу на телебаченні, з-но рах. №139 від 05.07.2019, в т.ч. ПДВ-5740,00 грн.",34440,юридична особа,оплата ефірного часу на телебаченні
Сила і Честь,211,1212,2019-07-05,44,"ПАТ ""НСТУ""","м. Київ, вул. Мельникова, буд. 42",23152907,"+;1212;оплата ефірного часу на радіо, зг-но дог. №99-32/3 від 01.07.2019, в т.ч. ПДВ-5931,40 грн.","35588,4",юридична особа,оплата ефірного часу на радіо
Сила і Честь,211,1211,2019-07-05,134,ТОВ Івано-Франк.ТРК КАНАЛ-402,"м. Івано-Франківськ, вул. Чорновола, буд. 99",13642036,"+;1211;оплата ефірного часу на телебаченні, з-но рах. №058 від 01.07.2019, в т.ч. ПДВ-6000,00 грн.",36000,юридична особа,оплата ефірного часу на телебаченні
Сила і Честь,211,1211,2019-07-05,122,ПП НТА-Незалежне телевізійне агентство,"м. Львів, вул. Винниченка, буд. 6",30053161,"+;1211;оплата ефірного часу на телебаченні, з-но рах. №89 від 05.07.2019, в т.ч. ПДВ-6840,00 грн.",41040,юридична особа,оплата ефірного часу на телебаченні
Сила і Честь,211,1211,2019-07-05,127,ТОВ ТРК ВІККА,"м. Черкаси, вул. Юрія Іллєнка, буд. 27",21385292,"+;1211;оплата ефірного часу на телебаченні, з-но рах. №СФ-000723 від 05.07.2019, в т.ч. ПДВ-7500,00 грн.",45000,юридична особа,оплата ефірного часу на телебаченні
Сила і Честь,211,1211,2019-07-05,92,ТОВ ТРК TTV,"м. Кропивницький, вул. Медвєдева, буд. 1А",13745760,"+;1211;оплата ефірного часу на телебаченні, з-но рах. №64 від 04.07.2019, в т.ч. ПДВ-7500,00 грн.",45000,юридична особа,оплата ефірного часу на телебаченні
Сила і Честь,211,1211,2019-07-05,107,ТОВ Інформаційний телеканал РЕПОРТЕР,"м. Одеса, вул. Зоопаркова, буд. 25",22448563,"+;1211;оплата ефірного часу на телебаченні, з-но рах. №117 від 03.07.2019, в т.ч. ПДВ-7560,00 грн.",45360,юридична особа,оплата ефірного часу на телебаченні
Сила і Честь,211,1211,2019-07-05,94,ТОВ ТРК Рівне-1,"м. Рівне, вул. Галицького, буд. 19, оф. 701",22573340,"+;1211;оплата ефірного часу на телебаченні, з-но рах. №СФ-0000039 від 05.07.2019, в т.ч. ПДВ-7700,00 грн.",46200,юридична особа,оплата ефірного часу на телебаченні
Сила і Честь,211,1212,2019-07-05,69,ТОВ ТРО Русское Радио - Україна,"м. Київ, вул. Сімʼї Хохлових, буд. 15, кімн. 3",31407092,"+;1212;оплата ефірного часу на радіо, зг-но рах. №СФ-0000433 від 01.07.2019, в т.ч. ПДВ-7770,00 грн.",46620,юридична особа,оплата ефірного часу на радіо
Сила і Честь,211,1211,2019-07-05,86,ТОВ TV-4,"м. Тернопіль, вул. Сагайдачного, буд. 2/7",14029496,"+;1211;оплата ефірного часу на телебаченні, з-но рах. №ТВ-0000227 від 05.07.2019, в т.ч. ПДВ-7920,00 грн.",47520,юридична особа,оплата ефірного часу на телебаченні
Сила і Честь,211,1211,2019-07-05,129,ПМП ТРК ДАНІО,"м. Ужгород, вул. Крилова, буд. 10",20430464,"+;1211;оплата ефірного часу на телебаченні, з-но рах. №41 від 04.07.2019. в т.ч. ПДВ-8100,00 грн.",48600,юридична особа,оплата ефірного часу на телебаченні
Сила і Честь,211,1212,2019-07-05,57,ТОВ ТРК Медіа маркет,"м. Київ, вул. Павлівська, буд. 29, кімн. 23А",31306998,"+;1212;оплата ефірного часу на радіо, зг-но рах. №СФ-0000389 від 02.07.2019, в т.ч. ПДВ-8400,00 грн.",50400,юридична особа,оплата ефірного часу на радіо
Сила і Честь,211,1211,2019-07-05,87,ТОВ ТРК 3-Студія,"м. Івано-Франківськ, вул. Січових Стрільців, буд. 56",23797886,"+;1211;оплата ефірного часу на телебаченні, з-но рах. №СФ-0000054 від 01.07.2019, в т.ч. ПДВ-9380,00 грн.",56280,юридична особа,оплата ефірного часу на телебаченні
Сила і Честь,211,1211,2019-07-05,123,ТОВ ЗНТРК ТВ-5,"м. Запоріжжя, вул. О. Пивоварова, буд. 4А",13630346,"+;1211;оплата ефірного часу на телебаченні, з-но рах. №0242 від 01.07.2019, в т.ч. ПДВ-9975,00 грн.",59850,юридична особа,оплата ефірного часу на телебаченні
Сила і Честь,211,1211,2019-07-05,150,ТОВ ТРК КРУГ,"Одеська обл., Овідіопольський р-н, смт Овідіополь, вул. Дзержинського, буд. 1",25049898,"+;1211;оплата ефірного часу на телебаченні, з-но рах. №68 від 02.07.2019, в т.ч. ПДВ-10000,00 грн.",60000,юридична особа,оплата ефірного часу на телебаченні
Сила і Честь,211,1211,2019-07-05,91,ТОВ Коледж преси та телебачення,"м. Миколаїв, вул. Даял, буд. 11А",20914191,"+;1211;оплата ефірного часу на телебаченні, з-но рах. №2-СІЧ від 04.07.2019, без ПДВ.",60000,юридична особа,оплата ефірного часу на телебаченні
Сила і Честь,211,1211,2019-07-05,145,ТОВ МЕДІАГРУП АЛЕКС.ЮА,"м. Запоріжжя, просп. Моторобудівників, буд. 48",24451003,"+;1211;оплата ефірного часу на телебаченні, з-но рах. №СФ-0000130 від 01.07.2019, в т.ч. ПДВ-10530,00 грн.",63180,юридична особа,оплата ефірного часу на телебаченні
Сила і Честь,211,1211,2019-07-05,113,"ТОВ ""Слово Волині""","м. Луцьк, вул. Єршова, буд. 2",38131299,"+;1211;оплата ефірного часу на телебаченні, з-но рах. №153 від 05.07.2019, в т.ч. ПДВ-10686,00 грн.",64116,юридична особа,оплата ефірного часу на телебаченні
Сила і Честь,211,1211,2019-07-05,99,ТОВ ТРК НІС-ТВ,"м. Миколаїв, вул. Чкалова, буд. 30А",20874043,"+;1211;оплата ефірного часу на телебаченні, з-но рах. №131 від 05.07.2019, в т.ч. ПДВ-10800,00 грн.",64800,юридична особа,оплата ефірного часу на телебаченні
Сила і Честь,211,1211,2019-07-05,115,ТОВ ТРК Сімон.,"м. Харків, пл. Свободи, буд. 7",21217525,"+;1211;оплата ефірного часу на телебаченні, з-но рах. №236 від 03.07.2019, в т.ч. ПДВ-11325,00 грн.",67950,юридична особа,оплата ефірного часу на телебаченні
Сила і Честь,211,1211,2019-07-05,120,"ДП ""Телерадіокомпанія ""Аверс""","м. Луцьк, вул. Електроапаратна, буд. 3",21755180,"+;1211;оплата ефірного часу на телебаченні, з-но рах. №СФ-0000121 від 05.07.2019, в т.ч. ПДВ-11466,00 грн.",68796,юридична особа,оплата ефірного часу на телебаченні
Сила і Честь,211,1211,2019-07-05,106,ТОВ ТРК ІРТ-Полтава,"м. Полтава, вул. Конституції, буд. 4",35026331,"+;1211;оплата ефірного часу на телебаченні, з-но рах. №ІР-2866/3 від 02.07.2019, в т.ч. ПДВ-12000,00 грн",72000,юридична особа,оплата ефірного часу на телебаченні
Сила і Честь,211,1211,2019-07-05,95,ТОВ ТРК Рівне-1,"м. Рівне, вул. Галицького, буд. 19, оф. 701",22573340,"+;1211;оплата ефірного часу на телебаченні, з-но рах. №СФ-0000040 від 05.07.2019, в т.ч. ПДВ-12000,00 грн.",72000,юридична особа,оплата ефірного часу на телебаченні
Сила і Честь,211,1211,2019-07-05,97,ПП ТРК СФЕРА-ТВ,"м. Рівне, вул. Міцкевича, буд. 11, оф. 30",33910609,"+;1211;оплата ефірного часу на телебаченні, з-но рах. №11/п/2 від 05.07.2019, без ПДВ.",72000,юридична особа,оплата ефірного часу на телебаченні
Сила і Честь,211,1211,2019-07-05,135,ТОВ ТРК МОЯ ОДЕСА,"м. Одеса, вул. Канатна, буд. 10",31068509,"+;1211;оплата ефірного часу на телебаченні, з-но рах. №72 від 02.07.2019, в т.ч. ПДВ-12600,00 грн.",75600,юридична особа,оплата ефірного часу на телебаченні
Сила і Честь,211,1211,2019-07-05,152,КП ТРА Новий Чернігів ЧМР,"м. Чернігів, просп. Миру, буд. 38А",21397527,"+;1211;оплата ефірного часу на телебаченні, з-но рах. №116 від 03.07.2019, в т.ч. ПДВ-14000,00 грн.",84000,юридична особа,оплата ефірного часу на телебаченні
Сила і Честь,211,1211,2019-07-05,88,"ТОВ ""Чернівецький промінь""","м. Чернівці, вул. Університетська, буд. 20",37722525,"+;1211;оплата ефірного часу на телебаченні, з-но рах. №12/07-2019 від 05.07.2019, без ПДВ.",103800,юридична особа,оплата ефірного часу на телебаченні
Сила і Честь,211,1211,2019-07-05,112,"ТОВ ""Слово Волині""","м. Луцьк, вул. Єршова, буд. 2",38131299,"+;1211;оплата ефірного часу на телебаченні, з-но рах. №152 від 05.07.2019, в т.ч. ПДВ-18000,00 грн.",108000,юридична особа,оплата ефірного часу на телебаченні
Сила і Честь,211,1211,2019-07-05,121,ПП НТА-Незалежне телевізійне агентство,"м. Львів, вул. Винниченка, буд. 6",30053161,"+;1211;оплата ефірного часу на телебаченні, з-но рах. №90 від 05.07.2019, в т.ч. ПДВ-18000,00 грн.",108000,юридична особа,оплата ефірного часу на телебаченні
Сила і Честь,211,1211,2019-07-05,140,КП ТРК ПЕРШИЙ ЗАХІДНИЙ,"м. Львів, вул. Підвальна, буд. 3",31074340,"+;1211;оплата ефірного часу на телебаченні, з-но рах. №164 від 05.07.2019, в т.ч. ПДВ-18000,00 грн.",108000,юридична особа,оплата ефірного часу на телебаченні
Сила і Честь,211,1211,2019-07-05,114,ТОВ ТРК Сімон.,"м. Харків, пл. Свободи, буд. 7",21217525,"+;1211;оплата ефірного часу на телебаченні, з-но рах. №244 від 05.07.2019, в т.ч. ПДВ-24166,67 грн.",145000,юридична особа,оплата ефірного часу на телебаченні
Сила і Честь,211,1340,2019-07-08,173,"КЗ ""Палац культури міста Луцька""","м. Луцьк, вул. Богдана Хмельницького, буд. 1",20120901,"+;1340;оренда приміщ. усіх форм власн., для пров. зборів громад, інш. публ.зах. передвиб. агітації зг-но рах.№167 від 03.07.2019, в т.ч. ПДВ -83,33грн.",500,юридична особа,оренда будинків і приміщень усіх форм власності для проведення зборів громадян та інших зустрічей з виборцями
Сила і Честь,211,1340,2019-07-08,176,"ТОВ ""Поділля-Т""","м. Вінниця, вул. Пушкіна, буд. 4",42201885,"+;1340;оренда приміщ. усіх форм власн. для провед. зборів громад., інших публічн. зах. передвиб. агітації зг-но рах.№СФ-0271 від 26.06.2019, в т.ч. ПДВ-500,00гр",1700,юридична особа,оренда будинків і приміщень усіх форм власності для проведення зборів громадян та інших зустрічей з виборцями
Сила і Честь,211,1120,2019-07-08,155,ТОВ ТРК АЛЕКС,"м. Запоріжжя, просп. Моторобудівників, буд. 48",23286602,"+;1120; виготовлення відео записів, з-но рах. від 01.07.2019 №СФ-0000205, в т.ч. ПДВ-500,00 грн.",3000,юридична особа,виготовлення відеозаписів
Сила і Честь,211,1211,2019-07-08,174,ПП ТРК СФЕРА-ТВ,"м. Рівне, вул. Міцкевича, буд. 11, оф. 30",33910609,"+;1211;оплата ефірного часу на телебаченні зг-но рах.№ 7/п/3,від 05.07.2019, без ПДВ",3500,юридична особа,оплата ефірного часу на телебаченні
Сила і Честь,211,1340,2019-07-08,175,Вінницька філармонія ім. М.Д. Леонтовича,"м. Вінниця, вул. Хмельницьке шосе, буд. 7",02224778,"+;1340;оренда приміщ. усіх форм власн. для провед.зборів громад., інших публічн.заходів передвиб. агітацїї, зг-но рах.№31, від 26.06.2019, в т.ч.ПДВ-1000,00грн.",6000,юридична особа,оренда будинків і приміщень усіх форм власності для проведення зборів громадян та інших зустрічей з виборцями
Сила і Честь,211,1220,2019-07-08,156,"ТОВ ""Юридична фірма ""Правник""","м. Дніпро, вул. Столярова, буд. 1",33669201,"+;1220;публікування агітац. матеріалів у друк. засобах масової інформації зг- но рах. №2672 від 03.07.2019, в.т.ч. ПДВ1077,08грн.","6462,5",юридична особа,оплата друкованих площ у друкованих засобах масової інформації
Сила і Честь,211,1220,2019-07-08,179,ТОВ Редакція КМГ Червоний гірник,"м. Кривий Ріг, просп. Металургів, буд. 28",02471933,"+;1220;опублікування агітаційних матеріалів у друкованих засобах масової інформації, зг- но рах. №222 від 08.07.2019, в т.ч. ПДВ-1185,60 грн.","7113,6",юридична особа,оплата друкованих площ у друкованих засобах масової інформації
Сила і Честь,211,1211,2019-07-08,163,ТОВ ТРК СОЮЗ-ТВ,"м. Житомир, просп. Миру, буд. 11, кв. 158",25304801,"+;1211;оплата ефірного часу на телебаченні зг-но. рах.№5/2 від 05.07.2019, в т.ч. ПДВ-1400,00грн.",8400,юридична особа,оплата ефірного часу на телебаченні
Сила і Честь,211,1211,2019-07-08,162,ТОВ ТРК СОЮЗ-ТВ,"м. Житомир, просп. Миру, буд. 11, кв. 158",25304801,"+;1211;оплата ефірного часу на телебаченні, зг-но рах. №5/3 від 05.07.2019, в т.ч. ПДВ-1519,00грн.",9114,юридична особа,оплата ефірного часу на телебаченні
Сила і Честь,211,1220,2019-07-08,193,ПП Полтавський вісник,"м. Полтава, вул. Європейська, буд. 8",21045231,"+;1220;опублікування агітаційних матеріалів у друкованих засобах масової інформації, зг- но рах. №СФ-0000245 від 08.07.2019, в т.ч. ПДВ-1525,70 грн.","9154,2",юридична особа,оплата друкованих площ у друкованих засобах масової інформації
Сила і Честь,211,1220,2019-07-08,189,ПП ВД Приватна газета,"м. Кременчук, вул. Шевченка, буд. 50А",31435638,"+;1220;опублікування агітаційних матеріалів у друкованих засобах масової інформації, зг- но рах. №ПГ-117 від 03.07.2019, в т.ч. ПДВ-1536,00 грн.",9216,юридична особа,оплата друкованих площ у друкованих засобах масової інформації
Сила і Честь,211,1220,2019-07-08,180,ППФ Інститут політики,"м. Рівне, вул. Степана Бандери, буд. 1Б",32940357,"+;1220;опублікування агітаційних матеріалів у друкованих засобах масової інформації, зг- но рах. №ІП127 від 08.07.2019, в т.ч. ПДВ-1587,67 грн.",9526,юридична особа,оплата друкованих площ у друкованих засобах масової інформації
Сила і Честь,211,1220,2019-07-08,194,ТОВ ТД Петро і Павел,"м. Суми, вул. Петропавлівська, буд. 70",21111962,"+;1220;опублікування агітаційних матеріалів у друкованих засобах масової інформації, зг- но рах. №4/4144 від 08.07.2019, в т.ч. ПДВ-1590,00 грн.",9540,юридична особа,оплата друкованих площ у друкованих засобах масової інформації
Сила і Честь,211,1211,2019-07-08,159,КП Муніципальна телевізійна мережа,"м. Запоріжжя, вул. Приходська, буд. 60",24905384,"+;1211;оплата ефірного часу на телебаченні зг-но рах.№СФ-0000110 від 01.07.2019, в т.ч. ПДВ-1650,00грн.",9900,юридична особа,оплата ефірного часу на телебаченні
Сила і Честь,211,1220,2019-07-08,181,ППФ Інститут політики,"м. Рівне, вул. Степана Бандери, буд. 1Б",32940357,"+;1220;опублікування агітаційних матеріалів у друкованих засобах масової інформації, зг- но рах. №ІП128 від 08.07.2019, в т.ч. ПДВ-2165,00 грн.",12990,юридична особа,оплата друкованих площ у друкованих засобах масової інформації
